[
  {
    "days_since_update": 14,
    "days_to_expiry": 26826,
    "expires_at": "2099-01-01",
    "has_github_secret": true,
    "has_txt_file": false,
    "is_secret": true,
    "name": "THIS_IS_A_NEW_SECRET",
    "repo": "secrets",
    "scope": "org",
    "txt_filename": null,
    "updated_at": "2025-07-08"
  }
]

