[
  {
    "days_since_update": 14,
    "days_to_expiry": 2,
    "expires_at": "2025-07-24",
    "has_github_secret": true,
    "has_txt_file": true,
    "is_secret": true,
    "name": "THIS_IS_A_NEW_SECRET",
    "repo": "secrets",
    "scope": "org",
    "txt_filename": "txt_root/secrets/gh-org-this-is-a-new-secret.txt",
    "updated_at": "2025-07-08"
  }
]
