[
  {
    "days_since_update": null,
    "days_to_expiry": 7,
    "expires_at": "2025-07-29",
    "has_github_secret": false,
    "has_txt_file": true,
    "is_secret": true,
    "name": "KOSLI_API_TOKEN_PROD",
    "repo": "secrets",
    "scope": "org",
    "txt_filename": "txt_root/secrets/gh-org-kosli-api-token.txt",
    "updated_at": null
  }
]
