[
  {
    "days_since_update": 14,
    "days_to_expiry": 23,
    "expires_at": "2025-08-14",
    "has_github_secret": true,
    "has_txt_file": true,
    "is_secret": true,
    "name": "KOSLI_API_TOKEN_PROD",
    "repo": "server",
    "scope": "org",
    "txt_filename": "txt_root/server/gh-org-kosli-api-token.txt",
    "updated_at": "2025-07-08"
  },
  {
    "days_since_update": 14,
    "days_to_expiry": 32,
    "expires_at": "2025-08-23",
    "has_github_secret": true,
    "has_txt_file": true,
    "is_secret": true,
    "name": "WIBBLE",
    "repo": "cli",
    "scope": "repo",
    "txt_filename": "txt_root/cli/gh-repo-wibble.txt",
    "updated_at": "2025-07-08"
  },
  {
    "days_since_update": 14,
    "days_to_expiry": 26826,
    "expires_at": "2099-01-01",
    "has_github_secret": true,
    "has_txt_file": false,
    "is_secret": true,
    "name": "WIBBLE",
    "repo": "terraform",
    "scope": "repo",
    "txt_filename": null,
    "updated_at": "2025-07-08"
  }
]