[
  {
    "days_since_update": 14,
    "days_to_expiry": 7,
    "expires_at": "2025-07-29",
    "has_github_secret": true,
    "has_txt_file": true,
    "is_secret": true,
    "name": "KOSLI_API_TOKEN_PROD",
    "repo": "secrets",
    "scope": "org",
    "txt_filename": "txt_root/secrets/gh-org-kosli-api-token.txt",
    "updated_at": "2025-07-08"
  },
  {
    "days_since_update": 14,
    "days_to_expiry": 26826,
    "expires_at": "2099-01-01",
    "has_github_secret": true,
    "has_txt_file": false,
    "is_secret": true,
    "name": "FOOBAR",
    "repo": "cli",
    "scope": "repo",
    "txt_filename": null,
    "updated_at": "2025-07-08"
  }
]
